#
# Testing crash recovery when log_compressed_pages=OFF
#
# Don't test this under valgrind, memory leaks will occur
# Binary must be compiled with debug for crash to occur
DROP TABLE IF EXISTS t1;
SET GLOBAL INNODB_FILE_FORMAT = 'Barracuda';
CREATE TABLE t1(id INT PRIMARY KEY, msg VARCHAR(255))
ENGINE=INNODB
ROW_FORMAT=COMPRESSED
KEY_BLOCK_SIZE=1;
create procedure setcrash(IN i INT)
begin
CASE i
WHEN 1 THEN SET SESSION debug="d,crash_commit_after_prepare";
WHEN 2 THEN SET SESSION debug="d,crash_commit_after_log";
WHEN 3 THEN SET SESSION debug="d,crash_commit_before_unlog";
WHEN 4 THEN SET SESSION debug="d,crash_commit_after";
WHEN 5 THEN SET SESSION debug="d,crash_commit_before";
ELSE BEGIN END;
END CASE;
end //
SET GLOBAL innodb_log_compressed_pages = OFF;
SET GLOBAL innodb_log_compressed_pages = OFF;
START TRANSACTION;
INSERT INTO t1(id, msg)
VALUES (25, '');
INSERT INTO t1(id, msg)
VALUES (24, '');
INSERT INTO t1(id, msg)
VALUES (23, '');
INSERT INTO t1(id, msg)
VALUES (22, '');
INSERT INTO t1(id, msg)
VALUES (21, '');
INSERT INTO t1(id, msg)
VALUES (20, '');
INSERT INTO t1(id, msg)
VALUES (19, '');
INSERT INTO t1(id, msg)
VALUES (18, '');
INSERT INTO t1(id, msg)
VALUES (17, '');
INSERT INTO t1(id, msg)
VALUES (16, '');
INSERT INTO t1(id, msg)
VALUES (15, '');
INSERT INTO t1(id, msg)
VALUES (14, '');
INSERT INTO t1(id, msg)
VALUES (13, '');
INSERT INTO t1(id, msg)
VALUES (12, '');
INSERT INTO t1(id, msg)
VALUES (11, '');
INSERT INTO t1(id, msg)
VALUES (10, '');
INSERT INTO t1(id, msg)
VALUES (9, '');
INSERT INTO t1(id, msg)
VALUES (8, '');
INSERT INTO t1(id, msg)
VALUES (7, '');
INSERT INTO t1(id, msg)
VALUES (6, '');
INSERT INTO t1(id, msg)
VALUES (5, '');
INSERT INTO t1(id, msg)
VALUES (4, '');
INSERT INTO t1(id, msg)
VALUES (3, '');
INSERT INTO t1(id, msg)
VALUES (2, '');
INSERT INTO t1(id, msg)
VALUES (1, '');
COMMIT;
START TRANSACTION;
UPDATE t1 SET msg=REPEAT(PASSWORD(25), 5) WHERE id=25;
UPDATE t1 SET msg=REPEAT(PASSWORD(24), 5) WHERE id=24;
UPDATE t1 SET msg=REPEAT(PASSWORD(23), 5) WHERE id=23;
UPDATE t1 SET msg=REPEAT(PASSWORD(22), 5) WHERE id=22;
UPDATE t1 SET msg=REPEAT(PASSWORD(21), 5) WHERE id=21;
UPDATE t1 SET msg=REPEAT(PASSWORD(20), 5) WHERE id=20;
UPDATE t1 SET msg=REPEAT(PASSWORD(19), 5) WHERE id=19;
UPDATE t1 SET msg=REPEAT(PASSWORD(18), 5) WHERE id=18;
UPDATE t1 SET msg=REPEAT(PASSWORD(17), 5) WHERE id=17;
UPDATE t1 SET msg=REPEAT(PASSWORD(16), 5) WHERE id=16;
UPDATE t1 SET msg=REPEAT(PASSWORD(15), 5) WHERE id=15;
UPDATE t1 SET msg=REPEAT(PASSWORD(14), 5) WHERE id=14;
UPDATE t1 SET msg=REPEAT(PASSWORD(13), 5) WHERE id=13;
UPDATE t1 SET msg=REPEAT(PASSWORD(12), 5) WHERE id=12;
UPDATE t1 SET msg=REPEAT(PASSWORD(11), 5) WHERE id=11;
UPDATE t1 SET msg=REPEAT(PASSWORD(10), 5) WHERE id=10;
UPDATE t1 SET msg=REPEAT(PASSWORD(9), 5) WHERE id=9;
UPDATE t1 SET msg=REPEAT(PASSWORD(8), 5) WHERE id=8;
UPDATE t1 SET msg=REPEAT(PASSWORD(7), 5) WHERE id=7;
UPDATE t1 SET msg=REPEAT(PASSWORD(6), 5) WHERE id=6;
UPDATE t1 SET msg=REPEAT(PASSWORD(5), 5) WHERE id=5;
UPDATE t1 SET msg=REPEAT(PASSWORD(4), 5) WHERE id=4;
UPDATE t1 SET msg=REPEAT(PASSWORD(3), 5) WHERE id=3;
UPDATE t1 SET msg=REPEAT(PASSWORD(2), 5) WHERE id=2;
UPDATE t1 SET msg=REPEAT(PASSWORD(1), 5) WHERE id=1;
# Write file to make mysql-test-run.pl expect crash
call setcrash(5);
# Run the crashing query
COMMIT;
# Turn on reconnect
# Call script that will poll the server waiting for
# it to be back online again
SELECT * FROM t1;
id	msg
1	
2	
3	
4	
5	
6	
7	
8	
9	
10	
11	
12	
13	
14	
15	
16	
17	
18	
19	
20	
21	
22	
23	
24	
25	
TRUNCATE TABLE t1;
SET GLOBAL innodb_log_compressed_pages = OFF;
START TRANSACTION;
INSERT INTO t1(id, msg)
VALUES (25, '');
INSERT INTO t1(id, msg)
VALUES (24, '');
INSERT INTO t1(id, msg)
VALUES (23, '');
INSERT INTO t1(id, msg)
VALUES (22, '');
INSERT INTO t1(id, msg)
VALUES (21, '');
INSERT INTO t1(id, msg)
VALUES (20, '');
INSERT INTO t1(id, msg)
VALUES (19, '');
INSERT INTO t1(id, msg)
VALUES (18, '');
INSERT INTO t1(id, msg)
VALUES (17, '');
INSERT INTO t1(id, msg)
VALUES (16, '');
INSERT INTO t1(id, msg)
VALUES (15, '');
INSERT INTO t1(id, msg)
VALUES (14, '');
INSERT INTO t1(id, msg)
VALUES (13, '');
INSERT INTO t1(id, msg)
VALUES (12, '');
INSERT INTO t1(id, msg)
VALUES (11, '');
INSERT INTO t1(id, msg)
VALUES (10, '');
INSERT INTO t1(id, msg)
VALUES (9, '');
INSERT INTO t1(id, msg)
VALUES (8, '');
INSERT INTO t1(id, msg)
VALUES (7, '');
INSERT INTO t1(id, msg)
VALUES (6, '');
INSERT INTO t1(id, msg)
VALUES (5, '');
INSERT INTO t1(id, msg)
VALUES (4, '');
INSERT INTO t1(id, msg)
VALUES (3, '');
INSERT INTO t1(id, msg)
VALUES (2, '');
INSERT INTO t1(id, msg)
VALUES (1, '');
COMMIT;
START TRANSACTION;
UPDATE t1 SET msg=REPEAT(PASSWORD(25), 5) WHERE id=25;
UPDATE t1 SET msg=REPEAT(PASSWORD(24), 5) WHERE id=24;
UPDATE t1 SET msg=REPEAT(PASSWORD(23), 5) WHERE id=23;
UPDATE t1 SET msg=REPEAT(PASSWORD(22), 5) WHERE id=22;
UPDATE t1 SET msg=REPEAT(PASSWORD(21), 5) WHERE id=21;
UPDATE t1 SET msg=REPEAT(PASSWORD(20), 5) WHERE id=20;
UPDATE t1 SET msg=REPEAT(PASSWORD(19), 5) WHERE id=19;
UPDATE t1 SET msg=REPEAT(PASSWORD(18), 5) WHERE id=18;
UPDATE t1 SET msg=REPEAT(PASSWORD(17), 5) WHERE id=17;
UPDATE t1 SET msg=REPEAT(PASSWORD(16), 5) WHERE id=16;
UPDATE t1 SET msg=REPEAT(PASSWORD(15), 5) WHERE id=15;
UPDATE t1 SET msg=REPEAT(PASSWORD(14), 5) WHERE id=14;
UPDATE t1 SET msg=REPEAT(PASSWORD(13), 5) WHERE id=13;
UPDATE t1 SET msg=REPEAT(PASSWORD(12), 5) WHERE id=12;
UPDATE t1 SET msg=REPEAT(PASSWORD(11), 5) WHERE id=11;
UPDATE t1 SET msg=REPEAT(PASSWORD(10), 5) WHERE id=10;
UPDATE t1 SET msg=REPEAT(PASSWORD(9), 5) WHERE id=9;
UPDATE t1 SET msg=REPEAT(PASSWORD(8), 5) WHERE id=8;
UPDATE t1 SET msg=REPEAT(PASSWORD(7), 5) WHERE id=7;
UPDATE t1 SET msg=REPEAT(PASSWORD(6), 5) WHERE id=6;
UPDATE t1 SET msg=REPEAT(PASSWORD(5), 5) WHERE id=5;
UPDATE t1 SET msg=REPEAT(PASSWORD(4), 5) WHERE id=4;
UPDATE t1 SET msg=REPEAT(PASSWORD(3), 5) WHERE id=3;
UPDATE t1 SET msg=REPEAT(PASSWORD(2), 5) WHERE id=2;
UPDATE t1 SET msg=REPEAT(PASSWORD(1), 5) WHERE id=1;
# Write file to make mysql-test-run.pl expect crash
call setcrash(4);
# Run the crashing query
COMMIT;
# Turn on reconnect
# Call script that will poll the server waiting for
# it to be back online again
SELECT * FROM t1;
id	msg
1	*E6CC90B878B948C35E92B003C792C46C58C4AF40*E6CC90B878B948C35E92B003C792C46C58C4AF40*E6CC90B878B948C35E92B003C792C46C58C4AF40*E6CC90B878B948C35E92B003C792C46C58C4AF40*E6CC90B878B948C35E92B003C792C46C58C4AF40
2	*12033B78389744F3F39AC4CE4CCFCAD6960D8EA0*12033B78389744F3F39AC4CE4CCFCAD6960D8EA0*12033B78389744F3F39AC4CE4CCFCAD6960D8EA0*12033B78389744F3F39AC4CE4CCFCAD6960D8EA0*12033B78389744F3F39AC4CE4CCFCAD6960D8EA0
3	*C4E74DDDC9CC9E2FDCDB7F63B127FB638831262E*C4E74DDDC9CC9E2FDCDB7F63B127FB638831262E*C4E74DDDC9CC9E2FDCDB7F63B127FB638831262E*C4E74DDDC9CC9E2FDCDB7F63B127FB638831262E*C4E74DDDC9CC9E2FDCDB7F63B127FB638831262E
4	*908BE2B7EB7D7567F7FF98716850F59BA69AA9DB*908BE2B7EB7D7567F7FF98716850F59BA69AA9DB*908BE2B7EB7D7567F7FF98716850F59BA69AA9DB*908BE2B7EB7D7567F7FF98716850F59BA69AA9DB*908BE2B7EB7D7567F7FF98716850F59BA69AA9DB
5	*7534F9EAEE5B69A586D1E9C1ACE3E3F9F6FCC446*7534F9EAEE5B69A586D1E9C1ACE3E3F9F6FCC446*7534F9EAEE5B69A586D1E9C1ACE3E3F9F6FCC446*7534F9EAEE5B69A586D1E9C1ACE3E3F9F6FCC446*7534F9EAEE5B69A586D1E9C1ACE3E3F9F6FCC446
6	*C3AB9ECDF746570BBF9DCAA9DB3586D25956DC93*C3AB9ECDF746570BBF9DCAA9DB3586D25956DC93*C3AB9ECDF746570BBF9DCAA9DB3586D25956DC93*C3AB9ECDF746570BBF9DCAA9DB3586D25956DC93*C3AB9ECDF746570BBF9DCAA9DB3586D25956DC93
7	*23E7A7428138939FBE2F69D23E5B87383EFD83C9*23E7A7428138939FBE2F69D23E5B87383EFD83C9*23E7A7428138939FBE2F69D23E5B87383EFD83C9*23E7A7428138939FBE2F69D23E5B87383EFD83C9*23E7A7428138939FBE2F69D23E5B87383EFD83C9
8	*6AF37A8C78E3A957D16D98F12788D1CFB2987A4C*6AF37A8C78E3A957D16D98F12788D1CFB2987A4C*6AF37A8C78E3A957D16D98F12788D1CFB2987A4C*6AF37A8C78E3A957D16D98F12788D1CFB2987A4C*6AF37A8C78E3A957D16D98F12788D1CFB2987A4C
9	*7E9FDC7F61153649AB9A75CED26807DF74F86E65*7E9FDC7F61153649AB9A75CED26807DF74F86E65*7E9FDC7F61153649AB9A75CED26807DF74F86E65*7E9FDC7F61153649AB9A75CED26807DF74F86E65*7E9FDC7F61153649AB9A75CED26807DF74F86E65
10	*15B4A9F089BEC4C84A24C5148B14A80C14651492*15B4A9F089BEC4C84A24C5148B14A80C14651492*15B4A9F089BEC4C84A24C5148B14A80C14651492*15B4A9F089BEC4C84A24C5148B14A80C14651492*15B4A9F089BEC4C84A24C5148B14A80C14651492
11	*0801D10217B06C5A9F32430C1A34E030D41A0257*0801D10217B06C5A9F32430C1A34E030D41A0257*0801D10217B06C5A9F32430C1A34E030D41A0257*0801D10217B06C5A9F32430C1A34E030D41A0257*0801D10217B06C5A9F32430C1A34E030D41A0257
12	*AA803D048B666A933E512AA53B36C70174A37D1E*AA803D048B666A933E512AA53B36C70174A37D1E*AA803D048B666A933E512AA53B36C70174A37D1E*AA803D048B666A933E512AA53B36C70174A37D1E*AA803D048B666A933E512AA53B36C70174A37D1E
13	*DFC5E490F07E908D8E0301A9961A1294F1833CDB*DFC5E490F07E908D8E0301A9961A1294F1833CDB*DFC5E490F07E908D8E0301A9961A1294F1833CDB*DFC5E490F07E908D8E0301A9961A1294F1833CDB*DFC5E490F07E908D8E0301A9961A1294F1833CDB
14	*2BB4042681093EDDB139FE897BDC3E9DC66DB3E9*2BB4042681093EDDB139FE897BDC3E9DC66DB3E9*2BB4042681093EDDB139FE897BDC3E9DC66DB3E9*2BB4042681093EDDB139FE897BDC3E9DC66DB3E9*2BB4042681093EDDB139FE897BDC3E9DC66DB3E9
15	*164FDE5FF23E4F03CC876EC8C8E7AE2DF1D2A6B9*164FDE5FF23E4F03CC876EC8C8E7AE2DF1D2A6B9*164FDE5FF23E4F03CC876EC8C8E7AE2DF1D2A6B9*164FDE5FF23E4F03CC876EC8C8E7AE2DF1D2A6B9*164FDE5FF23E4F03CC876EC8C8E7AE2DF1D2A6B9
16	*AD32FD65062E11F28615AF007C00472353B8889B*AD32FD65062E11F28615AF007C00472353B8889B*AD32FD65062E11F28615AF007C00472353B8889B*AD32FD65062E11F28615AF007C00472353B8889B*AD32FD65062E11F28615AF007C00472353B8889B
17	*F2B30D366CFF7C4585A87B431F101272244C42C4*F2B30D366CFF7C4585A87B431F101272244C42C4*F2B30D366CFF7C4585A87B431F101272244C42C4*F2B30D366CFF7C4585A87B431F101272244C42C4*F2B30D366CFF7C4585A87B431F101272244C42C4
18	*3085545A58D808FEFA4545CCD601D5E3F7A92726*3085545A58D808FEFA4545CCD601D5E3F7A92726*3085545A58D808FEFA4545CCD601D5E3F7A92726*3085545A58D808FEFA4545CCD601D5E3F7A92726*3085545A58D808FEFA4545CCD601D5E3F7A92726
19	*D547752508864FE305B97CD907BD12A1121AA77F*D547752508864FE305B97CD907BD12A1121AA77F*D547752508864FE305B97CD907BD12A1121AA77F*D547752508864FE305B97CD907BD12A1121AA77F*D547752508864FE305B97CD907BD12A1121AA77F
20	*73CD70D3F4D94BFCB566501B2909C8D435FF0A11*73CD70D3F4D94BFCB566501B2909C8D435FF0A11*73CD70D3F4D94BFCB566501B2909C8D435FF0A11*73CD70D3F4D94BFCB566501B2909C8D435FF0A11*73CD70D3F4D94BFCB566501B2909C8D435FF0A11
21	*EBEFE38F24D7BF6DDD422948D227E9EB3C94527C*EBEFE38F24D7BF6DDD422948D227E9EB3C94527C*EBEFE38F24D7BF6DDD422948D227E9EB3C94527C*EBEFE38F24D7BF6DDD422948D227E9EB3C94527C*EBEFE38F24D7BF6DDD422948D227E9EB3C94527C
22	*AEA73029F4DC11A88BA257A99DC751663BD0A4CB*AEA73029F4DC11A88BA257A99DC751663BD0A4CB*AEA73029F4DC11A88BA257A99DC751663BD0A4CB*AEA73029F4DC11A88BA257A99DC751663BD0A4CB*AEA73029F4DC11A88BA257A99DC751663BD0A4CB
23	*DFB702FDA6D8C5DE6F7587F426C7C5B59428CAEB*DFB702FDA6D8C5DE6F7587F426C7C5B59428CAEB*DFB702FDA6D8C5DE6F7587F426C7C5B59428CAEB*DFB702FDA6D8C5DE6F7587F426C7C5B59428CAEB*DFB702FDA6D8C5DE6F7587F426C7C5B59428CAEB
24	*1FB259F059F8D6E3E3F80616C04F3CA55F71FA51*1FB259F059F8D6E3E3F80616C04F3CA55F71FA51*1FB259F059F8D6E3E3F80616C04F3CA55F71FA51*1FB259F059F8D6E3E3F80616C04F3CA55F71FA51*1FB259F059F8D6E3E3F80616C04F3CA55F71FA51
25	*6B462CB4DD641021AA46A360968BB179E0A6947F*6B462CB4DD641021AA46A360968BB179E0A6947F*6B462CB4DD641021AA46A360968BB179E0A6947F*6B462CB4DD641021AA46A360968BB179E0A6947F*6B462CB4DD641021AA46A360968BB179E0A6947F
TRUNCATE TABLE t1;
SET GLOBAL innodb_log_compressed_pages = OFF;
START TRANSACTION;
INSERT INTO t1(id, msg)
VALUES (25, '');
INSERT INTO t1(id, msg)
VALUES (24, '');
INSERT INTO t1(id, msg)
VALUES (23, '');
INSERT INTO t1(id, msg)
VALUES (22, '');
INSERT INTO t1(id, msg)
VALUES (21, '');
INSERT INTO t1(id, msg)
VALUES (20, '');
INSERT INTO t1(id, msg)
VALUES (19, '');
INSERT INTO t1(id, msg)
VALUES (18, '');
INSERT INTO t1(id, msg)
VALUES (17, '');
INSERT INTO t1(id, msg)
VALUES (16, '');
INSERT INTO t1(id, msg)
VALUES (15, '');
INSERT INTO t1(id, msg)
VALUES (14, '');
INSERT INTO t1(id, msg)
VALUES (13, '');
INSERT INTO t1(id, msg)
VALUES (12, '');
INSERT INTO t1(id, msg)
VALUES (11, '');
INSERT INTO t1(id, msg)
VALUES (10, '');
INSERT INTO t1(id, msg)
VALUES (9, '');
INSERT INTO t1(id, msg)
VALUES (8, '');
INSERT INTO t1(id, msg)
VALUES (7, '');
INSERT INTO t1(id, msg)
VALUES (6, '');
INSERT INTO t1(id, msg)
VALUES (5, '');
INSERT INTO t1(id, msg)
VALUES (4, '');
INSERT INTO t1(id, msg)
VALUES (3, '');
INSERT INTO t1(id, msg)
VALUES (2, '');
INSERT INTO t1(id, msg)
VALUES (1, '');
COMMIT;
START TRANSACTION;
UPDATE t1 SET msg=REPEAT(PASSWORD(25), 5) WHERE id=25;
UPDATE t1 SET msg=REPEAT(PASSWORD(24), 5) WHERE id=24;
UPDATE t1 SET msg=REPEAT(PASSWORD(23), 5) WHERE id=23;
UPDATE t1 SET msg=REPEAT(PASSWORD(22), 5) WHERE id=22;
UPDATE t1 SET msg=REPEAT(PASSWORD(21), 5) WHERE id=21;
UPDATE t1 SET msg=REPEAT(PASSWORD(20), 5) WHERE id=20;
UPDATE t1 SET msg=REPEAT(PASSWORD(19), 5) WHERE id=19;
UPDATE t1 SET msg=REPEAT(PASSWORD(18), 5) WHERE id=18;
UPDATE t1 SET msg=REPEAT(PASSWORD(17), 5) WHERE id=17;
UPDATE t1 SET msg=REPEAT(PASSWORD(16), 5) WHERE id=16;
UPDATE t1 SET msg=REPEAT(PASSWORD(15), 5) WHERE id=15;
UPDATE t1 SET msg=REPEAT(PASSWORD(14), 5) WHERE id=14;
UPDATE t1 SET msg=REPEAT(PASSWORD(13), 5) WHERE id=13;
UPDATE t1 SET msg=REPEAT(PASSWORD(12), 5) WHERE id=12;
UPDATE t1 SET msg=REPEAT(PASSWORD(11), 5) WHERE id=11;
UPDATE t1 SET msg=REPEAT(PASSWORD(10), 5) WHERE id=10;
UPDATE t1 SET msg=REPEAT(PASSWORD(9), 5) WHERE id=9;
UPDATE t1 SET msg=REPEAT(PASSWORD(8), 5) WHERE id=8;
UPDATE t1 SET msg=REPEAT(PASSWORD(7), 5) WHERE id=7;
UPDATE t1 SET msg=REPEAT(PASSWORD(6), 5) WHERE id=6;
UPDATE t1 SET msg=REPEAT(PASSWORD(5), 5) WHERE id=5;
UPDATE t1 SET msg=REPEAT(PASSWORD(4), 5) WHERE id=4;
UPDATE t1 SET msg=REPEAT(PASSWORD(3), 5) WHERE id=3;
UPDATE t1 SET msg=REPEAT(PASSWORD(2), 5) WHERE id=2;
UPDATE t1 SET msg=REPEAT(PASSWORD(1), 5) WHERE id=1;
# Write file to make mysql-test-run.pl expect crash
call setcrash(3);
# Run the crashing query
COMMIT;
# Turn on reconnect
# Call script that will poll the server waiting for
# it to be back online again
SELECT * FROM t1;
id	msg
1	*E6CC90B878B948C35E92B003C792C46C58C4AF40*E6CC90B878B948C35E92B003C792C46C58C4AF40*E6CC90B878B948C35E92B003C792C46C58C4AF40*E6CC90B878B948C35E92B003C792C46C58C4AF40*E6CC90B878B948C35E92B003C792C46C58C4AF40
2	*12033B78389744F3F39AC4CE4CCFCAD6960D8EA0*12033B78389744F3F39AC4CE4CCFCAD6960D8EA0*12033B78389744F3F39AC4CE4CCFCAD6960D8EA0*12033B78389744F3F39AC4CE4CCFCAD6960D8EA0*12033B78389744F3F39AC4CE4CCFCAD6960D8EA0
3	*C4E74DDDC9CC9E2FDCDB7F63B127FB638831262E*C4E74DDDC9CC9E2FDCDB7F63B127FB638831262E*C4E74DDDC9CC9E2FDCDB7F63B127FB638831262E*C4E74DDDC9CC9E2FDCDB7F63B127FB638831262E*C4E74DDDC9CC9E2FDCDB7F63B127FB638831262E
4	*908BE2B7EB7D7567F7FF98716850F59BA69AA9DB*908BE2B7EB7D7567F7FF98716850F59BA69AA9DB*908BE2B7EB7D7567F7FF98716850F59BA69AA9DB*908BE2B7EB7D7567F7FF98716850F59BA69AA9DB*908BE2B7EB7D7567F7FF98716850F59BA69AA9DB
5	*7534F9EAEE5B69A586D1E9C1ACE3E3F9F6FCC446*7534F9EAEE5B69A586D1E9C1ACE3E3F9F6FCC446*7534F9EAEE5B69A586D1E9C1ACE3E3F9F6FCC446*7534F9EAEE5B69A586D1E9C1ACE3E3F9F6FCC446*7534F9EAEE5B69A586D1E9C1ACE3E3F9F6FCC446
6	*C3AB9ECDF746570BBF9DCAA9DB3586D25956DC93*C3AB9ECDF746570BBF9DCAA9DB3586D25956DC93*C3AB9ECDF746570BBF9DCAA9DB3586D25956DC93*C3AB9ECDF746570BBF9DCAA9DB3586D25956DC93*C3AB9ECDF746570BBF9DCAA9DB3586D25956DC93
7	*23E7A7428138939FBE2F69D23E5B87383EFD83C9*23E7A7428138939FBE2F69D23E5B87383EFD83C9*23E7A7428138939FBE2F69D23E5B87383EFD83C9*23E7A7428138939FBE2F69D23E5B87383EFD83C9*23E7A7428138939FBE2F69D23E5B87383EFD83C9
8	*6AF37A8C78E3A957D16D98F12788D1CFB2987A4C*6AF37A8C78E3A957D16D98F12788D1CFB2987A4C*6AF37A8C78E3A957D16D98F12788D1CFB2987A4C*6AF37A8C78E3A957D16D98F12788D1CFB2987A4C*6AF37A8C78E3A957D16D98F12788D1CFB2987A4C
9	*7E9FDC7F61153649AB9A75CED26807DF74F86E65*7E9FDC7F61153649AB9A75CED26807DF74F86E65*7E9FDC7F61153649AB9A75CED26807DF74F86E65*7E9FDC7F61153649AB9A75CED26807DF74F86E65*7E9FDC7F61153649AB9A75CED26807DF74F86E65
10	*15B4A9F089BEC4C84A24C5148B14A80C14651492*15B4A9F089BEC4C84A24C5148B14A80C14651492*15B4A9F089BEC4C84A24C5148B14A80C14651492*15B4A9F089BEC4C84A24C5148B14A80C14651492*15B4A9F089BEC4C84A24C5148B14A80C14651492
11	*0801D10217B06C5A9F32430C1A34E030D41A0257*0801D10217B06C5A9F32430C1A34E030D41A0257*0801D10217B06C5A9F32430C1A34E030D41A0257*0801D10217B06C5A9F32430C1A34E030D41A0257*0801D10217B06C5A9F32430C1A34E030D41A0257
12	*AA803D048B666A933E512AA53B36C70174A37D1E*AA803D048B666A933E512AA53B36C70174A37D1E*AA803D048B666A933E512AA53B36C70174A37D1E*AA803D048B666A933E512AA53B36C70174A37D1E*AA803D048B666A933E512AA53B36C70174A37D1E
13	*DFC5E490F07E908D8E0301A9961A1294F1833CDB*DFC5E490F07E908D8E0301A9961A1294F1833CDB*DFC5E490F07E908D8E0301A9961A1294F1833CDB*DFC5E490F07E908D8E0301A9961A1294F1833CDB*DFC5E490F07E908D8E0301A9961A1294F1833CDB
14	*2BB4042681093EDDB139FE897BDC3E9DC66DB3E9*2BB4042681093EDDB139FE897BDC3E9DC66DB3E9*2BB4042681093EDDB139FE897BDC3E9DC66DB3E9*2BB4042681093EDDB139FE897BDC3E9DC66DB3E9*2BB4042681093EDDB139FE897BDC3E9DC66DB3E9
15	*164FDE5FF23E4F03CC876EC8C8E7AE2DF1D2A6B9*164FDE5FF23E4F03CC876EC8C8E7AE2DF1D2A6B9*164FDE5FF23E4F03CC876EC8C8E7AE2DF1D2A6B9*164FDE5FF23E4F03CC876EC8C8E7AE2DF1D2A6B9*164FDE5FF23E4F03CC876EC8C8E7AE2DF1D2A6B9
16	*AD32FD65062E11F28615AF007C00472353B8889B*AD32FD65062E11F28615AF007C00472353B8889B*AD32FD65062E11F28615AF007C00472353B8889B*AD32FD65062E11F28615AF007C00472353B8889B*AD32FD65062E11F28615AF007C00472353B8889B
17	*F2B30D366CFF7C4585A87B431F101272244C42C4*F2B30D366CFF7C4585A87B431F101272244C42C4*F2B30D366CFF7C4585A87B431F101272244C42C4*F2B30D366CFF7C4585A87B431F101272244C42C4*F2B30D366CFF7C4585A87B431F101272244C42C4
18	*3085545A58D808FEFA4545CCD601D5E3F7A92726*3085545A58D808FEFA4545CCD601D5E3F7A92726*3085545A58D808FEFA4545CCD601D5E3F7A92726*3085545A58D808FEFA4545CCD601D5E3F7A92726*3085545A58D808FEFA4545CCD601D5E3F7A92726
19	*D547752508864FE305B97CD907BD12A1121AA77F*D547752508864FE305B97CD907BD12A1121AA77F*D547752508864FE305B97CD907BD12A1121AA77F*D547752508864FE305B97CD907BD12A1121AA77F*D547752508864FE305B97CD907BD12A1121AA77F
20	*73CD70D3F4D94BFCB566501B2909C8D435FF0A11*73CD70D3F4D94BFCB566501B2909C8D435FF0A11*73CD70D3F4D94BFCB566501B2909C8D435FF0A11*73CD70D3F4D94BFCB566501B2909C8D435FF0A11*73CD70D3F4D94BFCB566501B2909C8D435FF0A11
21	*EBEFE38F24D7BF6DDD422948D227E9EB3C94527C*EBEFE38F24D7BF6DDD422948D227E9EB3C94527C*EBEFE38F24D7BF6DDD422948D227E9EB3C94527C*EBEFE38F24D7BF6DDD422948D227E9EB3C94527C*EBEFE38F24D7BF6DDD422948D227E9EB3C94527C
22	*AEA73029F4DC11A88BA257A99DC751663BD0A4CB*AEA73029F4DC11A88BA257A99DC751663BD0A4CB*AEA73029F4DC11A88BA257A99DC751663BD0A4CB*AEA73029F4DC11A88BA257A99DC751663BD0A4CB*AEA73029F4DC11A88BA257A99DC751663BD0A4CB
23	*DFB702FDA6D8C5DE6F7587F426C7C5B59428CAEB*DFB702FDA6D8C5DE6F7587F426C7C5B59428CAEB*DFB702FDA6D8C5DE6F7587F426C7C5B59428CAEB*DFB702FDA6D8C5DE6F7587F426C7C5B59428CAEB*DFB702FDA6D8C5DE6F7587F426C7C5B59428CAEB
24	*1FB259F059F8D6E3E3F80616C04F3CA55F71FA51*1FB259F059F8D6E3E3F80616C04F3CA55F71FA51*1FB259F059F8D6E3E3F80616C04F3CA55F71FA51*1FB259F059F8D6E3E3F80616C04F3CA55F71FA51*1FB259F059F8D6E3E3F80616C04F3CA55F71FA51
25	*6B462CB4DD641021AA46A360968BB179E0A6947F*6B462CB4DD641021AA46A360968BB179E0A6947F*6B462CB4DD641021AA46A360968BB179E0A6947F*6B462CB4DD641021AA46A360968BB179E0A6947F*6B462CB4DD641021AA46A360968BB179E0A6947F
TRUNCATE TABLE t1;
SET GLOBAL innodb_log_compressed_pages = OFF;
START TRANSACTION;
INSERT INTO t1(id, msg)
VALUES (25, '');
INSERT INTO t1(id, msg)
VALUES (24, '');
INSERT INTO t1(id, msg)
VALUES (23, '');
INSERT INTO t1(id, msg)
VALUES (22, '');
INSERT INTO t1(id, msg)
VALUES (21, '');
INSERT INTO t1(id, msg)
VALUES (20, '');
INSERT INTO t1(id, msg)
VALUES (19, '');
INSERT INTO t1(id, msg)
VALUES (18, '');
INSERT INTO t1(id, msg)
VALUES (17, '');
INSERT INTO t1(id, msg)
VALUES (16, '');
INSERT INTO t1(id, msg)
VALUES (15, '');
INSERT INTO t1(id, msg)
VALUES (14, '');
INSERT INTO t1(id, msg)
VALUES (13, '');
INSERT INTO t1(id, msg)
VALUES (12, '');
INSERT INTO t1(id, msg)
VALUES (11, '');
INSERT INTO t1(id, msg)
VALUES (10, '');
INSERT INTO t1(id, msg)
VALUES (9, '');
INSERT INTO t1(id, msg)
VALUES (8, '');
INSERT INTO t1(id, msg)
VALUES (7, '');
INSERT INTO t1(id, msg)
VALUES (6, '');
INSERT INTO t1(id, msg)
VALUES (5, '');
INSERT INTO t1(id, msg)
VALUES (4, '');
INSERT INTO t1(id, msg)
VALUES (3, '');
INSERT INTO t1(id, msg)
VALUES (2, '');
INSERT INTO t1(id, msg)
VALUES (1, '');
COMMIT;
START TRANSACTION;
UPDATE t1 SET msg=REPEAT(PASSWORD(25), 5) WHERE id=25;
UPDATE t1 SET msg=REPEAT(PASSWORD(24), 5) WHERE id=24;
UPDATE t1 SET msg=REPEAT(PASSWORD(23), 5) WHERE id=23;
UPDATE t1 SET msg=REPEAT(PASSWORD(22), 5) WHERE id=22;
UPDATE t1 SET msg=REPEAT(PASSWORD(21), 5) WHERE id=21;
UPDATE t1 SET msg=REPEAT(PASSWORD(20), 5) WHERE id=20;
UPDATE t1 SET msg=REPEAT(PASSWORD(19), 5) WHERE id=19;
UPDATE t1 SET msg=REPEAT(PASSWORD(18), 5) WHERE id=18;
UPDATE t1 SET msg=REPEAT(PASSWORD(17), 5) WHERE id=17;
UPDATE t1 SET msg=REPEAT(PASSWORD(16), 5) WHERE id=16;
UPDATE t1 SET msg=REPEAT(PASSWORD(15), 5) WHERE id=15;
UPDATE t1 SET msg=REPEAT(PASSWORD(14), 5) WHERE id=14;
UPDATE t1 SET msg=REPEAT(PASSWORD(13), 5) WHERE id=13;
UPDATE t1 SET msg=REPEAT(PASSWORD(12), 5) WHERE id=12;
UPDATE t1 SET msg=REPEAT(PASSWORD(11), 5) WHERE id=11;
UPDATE t1 SET msg=REPEAT(PASSWORD(10), 5) WHERE id=10;
UPDATE t1 SET msg=REPEAT(PASSWORD(9), 5) WHERE id=9;
UPDATE t1 SET msg=REPEAT(PASSWORD(8), 5) WHERE id=8;
UPDATE t1 SET msg=REPEAT(PASSWORD(7), 5) WHERE id=7;
UPDATE t1 SET msg=REPEAT(PASSWORD(6), 5) WHERE id=6;
UPDATE t1 SET msg=REPEAT(PASSWORD(5), 5) WHERE id=5;
UPDATE t1 SET msg=REPEAT(PASSWORD(4), 5) WHERE id=4;
UPDATE t1 SET msg=REPEAT(PASSWORD(3), 5) WHERE id=3;
UPDATE t1 SET msg=REPEAT(PASSWORD(2), 5) WHERE id=2;
UPDATE t1 SET msg=REPEAT(PASSWORD(1), 5) WHERE id=1;
# Write file to make mysql-test-run.pl expect crash
call setcrash(2);
# Run the crashing query
COMMIT;
# Turn on reconnect
# Call script that will poll the server waiting for
# it to be back online again
SELECT * FROM t1;
id	msg
1	*E6CC90B878B948C35E92B003C792C46C58C4AF40*E6CC90B878B948C35E92B003C792C46C58C4AF40*E6CC90B878B948C35E92B003C792C46C58C4AF40*E6CC90B878B948C35E92B003C792C46C58C4AF40*E6CC90B878B948C35E92B003C792C46C58C4AF40
2	*12033B78389744F3F39AC4CE4CCFCAD6960D8EA0*12033B78389744F3F39AC4CE4CCFCAD6960D8EA0*12033B78389744F3F39AC4CE4CCFCAD6960D8EA0*12033B78389744F3F39AC4CE4CCFCAD6960D8EA0*12033B78389744F3F39AC4CE4CCFCAD6960D8EA0
3	*C4E74DDDC9CC9E2FDCDB7F63B127FB638831262E*C4E74DDDC9CC9E2FDCDB7F63B127FB638831262E*C4E74DDDC9CC9E2FDCDB7F63B127FB638831262E*C4E74DDDC9CC9E2FDCDB7F63B127FB638831262E*C4E74DDDC9CC9E2FDCDB7F63B127FB638831262E
4	*908BE2B7EB7D7567F7FF98716850F59BA69AA9DB*908BE2B7EB7D7567F7FF98716850F59BA69AA9DB*908BE2B7EB7D7567F7FF98716850F59BA69AA9DB*908BE2B7EB7D7567F7FF98716850F59BA69AA9DB*908BE2B7EB7D7567F7FF98716850F59BA69AA9DB
5	*7534F9EAEE5B69A586D1E9C1ACE3E3F9F6FCC446*7534F9EAEE5B69A586D1E9C1ACE3E3F9F6FCC446*7534F9EAEE5B69A586D1E9C1ACE3E3F9F6FCC446*7534F9EAEE5B69A586D1E9C1ACE3E3F9F6FCC446*7534F9EAEE5B69A586D1E9C1ACE3E3F9F6FCC446
6	*C3AB9ECDF746570BBF9DCAA9DB3586D25956DC93*C3AB9ECDF746570BBF9DCAA9DB3586D25956DC93*C3AB9ECDF746570BBF9DCAA9DB3586D25956DC93*C3AB9ECDF746570BBF9DCAA9DB3586D25956DC93*C3AB9ECDF746570BBF9DCAA9DB3586D25956DC93
7	*23E7A7428138939FBE2F69D23E5B87383EFD83C9*23E7A7428138939FBE2F69D23E5B87383EFD83C9*23E7A7428138939FBE2F69D23E5B87383EFD83C9*23E7A7428138939FBE2F69D23E5B87383EFD83C9*23E7A7428138939FBE2F69D23E5B87383EFD83C9
8	*6AF37A8C78E3A957D16D98F12788D1CFB2987A4C*6AF37A8C78E3A957D16D98F12788D1CFB2987A4C*6AF37A8C78E3A957D16D98F12788D1CFB2987A4C*6AF37A8C78E3A957D16D98F12788D1CFB2987A4C*6AF37A8C78E3A957D16D98F12788D1CFB2987A4C
9	*7E9FDC7F61153649AB9A75CED26807DF74F86E65*7E9FDC7F61153649AB9A75CED26807DF74F86E65*7E9FDC7F61153649AB9A75CED26807DF74F86E65*7E9FDC7F61153649AB9A75CED26807DF74F86E65*7E9FDC7F61153649AB9A75CED26807DF74F86E65
10	*15B4A9F089BEC4C84A24C5148B14A80C14651492*15B4A9F089BEC4C84A24C5148B14A80C14651492*15B4A9F089BEC4C84A24C5148B14A80C14651492*15B4A9F089BEC4C84A24C5148B14A80C14651492*15B4A9F089BEC4C84A24C5148B14A80C14651492
11	*0801D10217B06C5A9F32430C1A34E030D41A0257*0801D10217B06C5A9F32430C1A34E030D41A0257*0801D10217B06C5A9F32430C1A34E030D41A0257*0801D10217B06C5A9F32430C1A34E030D41A0257*0801D10217B06C5A9F32430C1A34E030D41A0257
12	*AA803D048B666A933E512AA53B36C70174A37D1E*AA803D048B666A933E512AA53B36C70174A37D1E*AA803D048B666A933E512AA53B36C70174A37D1E*AA803D048B666A933E512AA53B36C70174A37D1E*AA803D048B666A933E512AA53B36C70174A37D1E
13	*DFC5E490F07E908D8E0301A9961A1294F1833CDB*DFC5E490F07E908D8E0301A9961A1294F1833CDB*DFC5E490F07E908D8E0301A9961A1294F1833CDB*DFC5E490F07E908D8E0301A9961A1294F1833CDB*DFC5E490F07E908D8E0301A9961A1294F1833CDB
14	*2BB4042681093EDDB139FE897BDC3E9DC66DB3E9*2BB4042681093EDDB139FE897BDC3E9DC66DB3E9*2BB4042681093EDDB139FE897BDC3E9DC66DB3E9*2BB4042681093EDDB139FE897BDC3E9DC66DB3E9*2BB4042681093EDDB139FE897BDC3E9DC66DB3E9
15	*164FDE5FF23E4F03CC876EC8C8E7AE2DF1D2A6B9*164FDE5FF23E4F03CC876EC8C8E7AE2DF1D2A6B9*164FDE5FF23E4F03CC876EC8C8E7AE2DF1D2A6B9*164FDE5FF23E4F03CC876EC8C8E7AE2DF1D2A6B9*164FDE5FF23E4F03CC876EC8C8E7AE2DF1D2A6B9
16	*AD32FD65062E11F28615AF007C00472353B8889B*AD32FD65062E11F28615AF007C00472353B8889B*AD32FD65062E11F28615AF007C00472353B8889B*AD32FD65062E11F28615AF007C00472353B8889B*AD32FD65062E11F28615AF007C00472353B8889B
17	*F2B30D366CFF7C4585A87B431F101272244C42C4*F2B30D366CFF7C4585A87B431F101272244C42C4*F2B30D366CFF7C4585A87B431F101272244C42C4*F2B30D366CFF7C4585A87B431F101272244C42C4*F2B30D366CFF7C4585A87B431F101272244C42C4
18	*3085545A58D808FEFA4545CCD601D5E3F7A92726*3085545A58D808FEFA4545CCD601D5E3F7A92726*3085545A58D808FEFA4545CCD601D5E3F7A92726*3085545A58D808FEFA4545CCD601D5E3F7A92726*3085545A58D808FEFA4545CCD601D5E3F7A92726
19	*D547752508864FE305B97CD907BD12A1121AA77F*D547752508864FE305B97CD907BD12A1121AA77F*D547752508864FE305B97CD907BD12A1121AA77F*D547752508864FE305B97CD907BD12A1121AA77F*D547752508864FE305B97CD907BD12A1121AA77F
20	*73CD70D3F4D94BFCB566501B2909C8D435FF0A11*73CD70D3F4D94BFCB566501B2909C8D435FF0A11*73CD70D3F4D94BFCB566501B2909C8D435FF0A11*73CD70D3F4D94BFCB566501B2909C8D435FF0A11*73CD70D3F4D94BFCB566501B2909C8D435FF0A11
21	*EBEFE38F24D7BF6DDD422948D227E9EB3C94527C*EBEFE38F24D7BF6DDD422948D227E9EB3C94527C*EBEFE38F24D7BF6DDD422948D227E9EB3C94527C*EBEFE38F24D7BF6DDD422948D227E9EB3C94527C*EBEFE38F24D7BF6DDD422948D227E9EB3C94527C
22	*AEA73029F4DC11A88BA257A99DC751663BD0A4CB*AEA73029F4DC11A88BA257A99DC751663BD0A4CB*AEA73029F4DC11A88BA257A99DC751663BD0A4CB*AEA73029F4DC11A88BA257A99DC751663BD0A4CB*AEA73029F4DC11A88BA257A99DC751663BD0A4CB
23	*DFB702FDA6D8C5DE6F7587F426C7C5B59428CAEB*DFB702FDA6D8C5DE6F7587F426C7C5B59428CAEB*DFB702FDA6D8C5DE6F7587F426C7C5B59428CAEB*DFB702FDA6D8C5DE6F7587F426C7C5B59428CAEB*DFB702FDA6D8C5DE6F7587F426C7C5B59428CAEB
24	*1FB259F059F8D6E3E3F80616C04F3CA55F71FA51*1FB259F059F8D6E3E3F80616C04F3CA55F71FA51*1FB259F059F8D6E3E3F80616C04F3CA55F71FA51*1FB259F059F8D6E3E3F80616C04F3CA55F71FA51*1FB259F059F8D6E3E3F80616C04F3CA55F71FA51
25	*6B462CB4DD641021AA46A360968BB179E0A6947F*6B462CB4DD641021AA46A360968BB179E0A6947F*6B462CB4DD641021AA46A360968BB179E0A6947F*6B462CB4DD641021AA46A360968BB179E0A6947F*6B462CB4DD641021AA46A360968BB179E0A6947F
TRUNCATE TABLE t1;
SET GLOBAL innodb_log_compressed_pages = OFF;
START TRANSACTION;
INSERT INTO t1(id, msg)
VALUES (25, '');
INSERT INTO t1(id, msg)
VALUES (24, '');
INSERT INTO t1(id, msg)
VALUES (23, '');
INSERT INTO t1(id, msg)
VALUES (22, '');
INSERT INTO t1(id, msg)
VALUES (21, '');
INSERT INTO t1(id, msg)
VALUES (20, '');
INSERT INTO t1(id, msg)
VALUES (19, '');
INSERT INTO t1(id, msg)
VALUES (18, '');
INSERT INTO t1(id, msg)
VALUES (17, '');
INSERT INTO t1(id, msg)
VALUES (16, '');
INSERT INTO t1(id, msg)
VALUES (15, '');
INSERT INTO t1(id, msg)
VALUES (14, '');
INSERT INTO t1(id, msg)
VALUES (13, '');
INSERT INTO t1(id, msg)
VALUES (12, '');
INSERT INTO t1(id, msg)
VALUES (11, '');
INSERT INTO t1(id, msg)
VALUES (10, '');
INSERT INTO t1(id, msg)
VALUES (9, '');
INSERT INTO t1(id, msg)
VALUES (8, '');
INSERT INTO t1(id, msg)
VALUES (7, '');
INSERT INTO t1(id, msg)
VALUES (6, '');
INSERT INTO t1(id, msg)
VALUES (5, '');
INSERT INTO t1(id, msg)
VALUES (4, '');
INSERT INTO t1(id, msg)
VALUES (3, '');
INSERT INTO t1(id, msg)
VALUES (2, '');
INSERT INTO t1(id, msg)
VALUES (1, '');
COMMIT;
START TRANSACTION;
UPDATE t1 SET msg=REPEAT(PASSWORD(25), 5) WHERE id=25;
UPDATE t1 SET msg=REPEAT(PASSWORD(24), 5) WHERE id=24;
UPDATE t1 SET msg=REPEAT(PASSWORD(23), 5) WHERE id=23;
UPDATE t1 SET msg=REPEAT(PASSWORD(22), 5) WHERE id=22;
UPDATE t1 SET msg=REPEAT(PASSWORD(21), 5) WHERE id=21;
UPDATE t1 SET msg=REPEAT(PASSWORD(20), 5) WHERE id=20;
UPDATE t1 SET msg=REPEAT(PASSWORD(19), 5) WHERE id=19;
UPDATE t1 SET msg=REPEAT(PASSWORD(18), 5) WHERE id=18;
UPDATE t1 SET msg=REPEAT(PASSWORD(17), 5) WHERE id=17;
UPDATE t1 SET msg=REPEAT(PASSWORD(16), 5) WHERE id=16;
UPDATE t1 SET msg=REPEAT(PASSWORD(15), 5) WHERE id=15;
UPDATE t1 SET msg=REPEAT(PASSWORD(14), 5) WHERE id=14;
UPDATE t1 SET msg=REPEAT(PASSWORD(13), 5) WHERE id=13;
UPDATE t1 SET msg=REPEAT(PASSWORD(12), 5) WHERE id=12;
UPDATE t1 SET msg=REPEAT(PASSWORD(11), 5) WHERE id=11;
UPDATE t1 SET msg=REPEAT(PASSWORD(10), 5) WHERE id=10;
UPDATE t1 SET msg=REPEAT(PASSWORD(9), 5) WHERE id=9;
UPDATE t1 SET msg=REPEAT(PASSWORD(8), 5) WHERE id=8;
UPDATE t1 SET msg=REPEAT(PASSWORD(7), 5) WHERE id=7;
UPDATE t1 SET msg=REPEAT(PASSWORD(6), 5) WHERE id=6;
UPDATE t1 SET msg=REPEAT(PASSWORD(5), 5) WHERE id=5;
UPDATE t1 SET msg=REPEAT(PASSWORD(4), 5) WHERE id=4;
UPDATE t1 SET msg=REPEAT(PASSWORD(3), 5) WHERE id=3;
UPDATE t1 SET msg=REPEAT(PASSWORD(2), 5) WHERE id=2;
UPDATE t1 SET msg=REPEAT(PASSWORD(1), 5) WHERE id=1;
# Write file to make mysql-test-run.pl expect crash
call setcrash(1);
# Run the crashing query
COMMIT;
# Turn on reconnect
# Call script that will poll the server waiting for
# it to be back online again
SELECT * FROM t1;
id	msg
1	*E6CC90B878B948C35E92B003C792C46C58C4AF40*E6CC90B878B948C35E92B003C792C46C58C4AF40*E6CC90B878B948C35E92B003C792C46C58C4AF40*E6CC90B878B948C35E92B003C792C46C58C4AF40*E6CC90B878B948C35E92B003C792C46C58C4AF40
2	*12033B78389744F3F39AC4CE4CCFCAD6960D8EA0*12033B78389744F3F39AC4CE4CCFCAD6960D8EA0*12033B78389744F3F39AC4CE4CCFCAD6960D8EA0*12033B78389744F3F39AC4CE4CCFCAD6960D8EA0*12033B78389744F3F39AC4CE4CCFCAD6960D8EA0
3	*C4E74DDDC9CC9E2FDCDB7F63B127FB638831262E*C4E74DDDC9CC9E2FDCDB7F63B127FB638831262E*C4E74DDDC9CC9E2FDCDB7F63B127FB638831262E*C4E74DDDC9CC9E2FDCDB7F63B127FB638831262E*C4E74DDDC9CC9E2FDCDB7F63B127FB638831262E
4	*908BE2B7EB7D7567F7FF98716850F59BA69AA9DB*908BE2B7EB7D7567F7FF98716850F59BA69AA9DB*908BE2B7EB7D7567F7FF98716850F59BA69AA9DB*908BE2B7EB7D7567F7FF98716850F59BA69AA9DB*908BE2B7EB7D7567F7FF98716850F59BA69AA9DB
5	*7534F9EAEE5B69A586D1E9C1ACE3E3F9F6FCC446*7534F9EAEE5B69A586D1E9C1ACE3E3F9F6FCC446*7534F9EAEE5B69A586D1E9C1ACE3E3F9F6FCC446*7534F9EAEE5B69A586D1E9C1ACE3E3F9F6FCC446*7534F9EAEE5B69A586D1E9C1ACE3E3F9F6FCC446
6	*C3AB9ECDF746570BBF9DCAA9DB3586D25956DC93*C3AB9ECDF746570BBF9DCAA9DB3586D25956DC93*C3AB9ECDF746570BBF9DCAA9DB3586D25956DC93*C3AB9ECDF746570BBF9DCAA9DB3586D25956DC93*C3AB9ECDF746570BBF9DCAA9DB3586D25956DC93
7	*23E7A7428138939FBE2F69D23E5B87383EFD83C9*23E7A7428138939FBE2F69D23E5B87383EFD83C9*23E7A7428138939FBE2F69D23E5B87383EFD83C9*23E7A7428138939FBE2F69D23E5B87383EFD83C9*23E7A7428138939FBE2F69D23E5B87383EFD83C9
8	*6AF37A8C78E3A957D16D98F12788D1CFB2987A4C*6AF37A8C78E3A957D16D98F12788D1CFB2987A4C*6AF37A8C78E3A957D16D98F12788D1CFB2987A4C*6AF37A8C78E3A957D16D98F12788D1CFB2987A4C*6AF37A8C78E3A957D16D98F12788D1CFB2987A4C
9	*7E9FDC7F61153649AB9A75CED26807DF74F86E65*7E9FDC7F61153649AB9A75CED26807DF74F86E65*7E9FDC7F61153649AB9A75CED26807DF74F86E65*7E9FDC7F61153649AB9A75CED26807DF74F86E65*7E9FDC7F61153649AB9A75CED26807DF74F86E65
10	*15B4A9F089BEC4C84A24C5148B14A80C14651492*15B4A9F089BEC4C84A24C5148B14A80C14651492*15B4A9F089BEC4C84A24C5148B14A80C14651492*15B4A9F089BEC4C84A24C5148B14A80C14651492*15B4A9F089BEC4C84A24C5148B14A80C14651492
11	*0801D10217B06C5A9F32430C1A34E030D41A0257*0801D10217B06C5A9F32430C1A34E030D41A0257*0801D10217B06C5A9F32430C1A34E030D41A0257*0801D10217B06C5A9F32430C1A34E030D41A0257*0801D10217B06C5A9F32430C1A34E030D41A0257
12	*AA803D048B666A933E512AA53B36C70174A37D1E*AA803D048B666A933E512AA53B36C70174A37D1E*AA803D048B666A933E512AA53B36C70174A37D1E*AA803D048B666A933E512AA53B36C70174A37D1E*AA803D048B666A933E512AA53B36C70174A37D1E
13	*DFC5E490F07E908D8E0301A9961A1294F1833CDB*DFC5E490F07E908D8E0301A9961A1294F1833CDB*DFC5E490F07E908D8E0301A9961A1294F1833CDB*DFC5E490F07E908D8E0301A9961A1294F1833CDB*DFC5E490F07E908D8E0301A9961A1294F1833CDB
14	*2BB4042681093EDDB139FE897BDC3E9DC66DB3E9*2BB4042681093EDDB139FE897BDC3E9DC66DB3E9*2BB4042681093EDDB139FE897BDC3E9DC66DB3E9*2BB4042681093EDDB139FE897BDC3E9DC66DB3E9*2BB4042681093EDDB139FE897BDC3E9DC66DB3E9
15	*164FDE5FF23E4F03CC876EC8C8E7AE2DF1D2A6B9*164FDE5FF23E4F03CC876EC8C8E7AE2DF1D2A6B9*164FDE5FF23E4F03CC876EC8C8E7AE2DF1D2A6B9*164FDE5FF23E4F03CC876EC8C8E7AE2DF1D2A6B9*164FDE5FF23E4F03CC876EC8C8E7AE2DF1D2A6B9
16	*AD32FD65062E11F28615AF007C00472353B8889B*AD32FD65062E11F28615AF007C00472353B8889B*AD32FD65062E11F28615AF007C00472353B8889B*AD32FD65062E11F28615AF007C00472353B8889B*AD32FD65062E11F28615AF007C00472353B8889B
17	*F2B30D366CFF7C4585A87B431F101272244C42C4*F2B30D366CFF7C4585A87B431F101272244C42C4*F2B30D366CFF7C4585A87B431F101272244C42C4*F2B30D366CFF7C4585A87B431F101272244C42C4*F2B30D366CFF7C4585A87B431F101272244C42C4
18	*3085545A58D808FEFA4545CCD601D5E3F7A92726*3085545A58D808FEFA4545CCD601D5E3F7A92726*3085545A58D808FEFA4545CCD601D5E3F7A92726*3085545A58D808FEFA4545CCD601D5E3F7A92726*3085545A58D808FEFA4545CCD601D5E3F7A92726
19	*D547752508864FE305B97CD907BD12A1121AA77F*D547752508864FE305B97CD907BD12A1121AA77F*D547752508864FE305B97CD907BD12A1121AA77F*D547752508864FE305B97CD907BD12A1121AA77F*D547752508864FE305B97CD907BD12A1121AA77F
20	*73CD70D3F4D94BFCB566501B2909C8D435FF0A11*73CD70D3F4D94BFCB566501B2909C8D435FF0A11*73CD70D3F4D94BFCB566501B2909C8D435FF0A11*73CD70D3F4D94BFCB566501B2909C8D435FF0A11*73CD70D3F4D94BFCB566501B2909C8D435FF0A11
21	*EBEFE38F24D7BF6DDD422948D227E9EB3C94527C*EBEFE38F24D7BF6DDD422948D227E9EB3C94527C*EBEFE38F24D7BF6DDD422948D227E9EB3C94527C*EBEFE38F24D7BF6DDD422948D227E9EB3C94527C*EBEFE38F24D7BF6DDD422948D227E9EB3C94527C
22	*AEA73029F4DC11A88BA257A99DC751663BD0A4CB*AEA73029F4DC11A88BA257A99DC751663BD0A4CB*AEA73029F4DC11A88BA257A99DC751663BD0A4CB*AEA73029F4DC11A88BA257A99DC751663BD0A4CB*AEA73029F4DC11A88BA257A99DC751663BD0A4CB
23	*DFB702FDA6D8C5DE6F7587F426C7C5B59428CAEB*DFB702FDA6D8C5DE6F7587F426C7C5B59428CAEB*DFB702FDA6D8C5DE6F7587F426C7C5B59428CAEB*DFB702FDA6D8C5DE6F7587F426C7C5B59428CAEB*DFB702FDA6D8C5DE6F7587F426C7C5B59428CAEB
24	*1FB259F059F8D6E3E3F80616C04F3CA55F71FA51*1FB259F059F8D6E3E3F80616C04F3CA55F71FA51*1FB259F059F8D6E3E3F80616C04F3CA55F71FA51*1FB259F059F8D6E3E3F80616C04F3CA55F71FA51*1FB259F059F8D6E3E3F80616C04F3CA55F71FA51
25	*6B462CB4DD641021AA46A360968BB179E0A6947F*6B462CB4DD641021AA46A360968BB179E0A6947F*6B462CB4DD641021AA46A360968BB179E0A6947F*6B462CB4DD641021AA46A360968BB179E0A6947F*6B462CB4DD641021AA46A360968BB179E0A6947F
TRUNCATE TABLE t1;
DROP TABLE t1;
DROP PROCEDURE setcrash;
SET SESSION DEBUG= 'RESET';
